{
  "openpkg": "0.4.0",
  "meta": {
    "name": "@stacks/transactions",
    "version": "7.3.1",
    "description": "Javascript library for constructing transactions on the Stacks blockchain."
  },
  "exports": [
    {
      "id": "makeSTXTokenTransfer",
      "name": "makeSTXTokenTransfer",
      "kind": "function",
      "description": "Generates a signed Stacks token transfer transaction\n\nReturns a signed Stacks token transfer transaction.",
      "tags": [
        {
          "name": "param",
          "text": "txOptions - an options object for the token transfer",
          "param": {
            "name": "txOptions",
            "type": "SignedTokenTransferOptions | SignedMultiSigTokenTransferOptions",
            "description": "an options object for the token transfer"
          }
        },
        {
          "name": "return",
          "text": ""
        },
        {
          "name": "example",
          "text": "```ts\n// Basic STX transfer\nimport { makeSTXTokenTransfer, broadcastTransaction } from '@stacks/transactions';\n\nconst transaction = await makeSTXTokenTransfer({\n  recipient: 'SP2J6ZY48GV1EZ5V2V5RB9MP66SW86PYKKQHX0A73',\n  amount: 1000000n,\n  senderKey: 'b244296d5907de9864c0b0d51f98a13c52890b0498ba04f738be28738bc5821401',\n  network: 'testnet',\n});\n\nconst result = await broadcastTransaction({ transaction, network: 'testnet' });\nconsole.log('Transaction ID:', result.txid);\n```"
        },
        {
          "name": "example",
          "text": "```ts\n// Multi-sig STX transfer (2-of-3)\nimport { makeSTXTokenTransfer } from '@stacks/transactions';\n\nconst pubKey1 = '03a...',\n      pubKey2 = '02b...',\n      pubKey3 = '03c...';\n\nconst transaction = await makeSTXTokenTransfer({\n  recipient: 'SP2J6ZY48GV1EZ5V2V5RB9MP66SW86PYKKQHX0A73',\n  amount: 500000n,\n  numSignatures: 2,\n  publicKeys: [pubKey1, pubKey2, pubKey3],\n  signerKeys: [privateKey1, privateKey2],\n  network: 'mainnet',\n});\n```"
        }
      ],
      "source": {
        "file": "/tmp/stacks.js/packages/transactions/src/builders.ts",
        "line": 241
      },
      "signatures": [
        {
          "parameters": [
            {
              "name": "txOptions",
              "schema": {
                "anyOf": [
                  {
                    "$ref": "#/types/SignedTokenTransferOptions"
                  },
                  {
                    "$ref": "#/types/SignedMultiSigTokenTransferOptions"
                  }
                ]
              },
              "required": true,
              "description": "an options object for the token transfer"
            }
          ],
          "returns": {
            "schema": {
              "$ref": "#/types/Promise",
              "x-ts-type-arguments": [
                {
                  "$ref": "#/types/StacksTransactionWire"
                }
              ]
            }
          },
          "description": "Generates a signed Stacks token transfer transaction\n\nReturns a signed Stacks token transfer transaction.",
          "tags": [
            {
              "name": "param",
              "text": "txOptions - an options object for the token transfer",
              "param": {
                "name": "txOptions",
                "type": "SignedTokenTransferOptions | SignedMultiSigTokenTransferOptions",
                "description": "an options object for the token transfer"
              }
            },
            {
              "name": "return",
              "text": ""
            },
            {
              "name": "example",
              "text": "```ts\n// Basic STX transfer\nimport { makeSTXTokenTransfer, broadcastTransaction } from '@stacks/transactions';\n\nconst transaction = await makeSTXTokenTransfer({\n  recipient: 'SP2J6ZY48GV1EZ5V2V5RB9MP66SW86PYKKQHX0A73',\n  amount: 1000000n,\n  senderKey: 'b244296d5907de9864c0b0d51f98a13c52890b0498ba04f738be28738bc5821401',\n  network: 'testnet',\n});\n\nconst result = await broadcastTransaction({ transaction, network: 'testnet' });\nconsole.log('Transaction ID:', result.txid);\n```"
            },
            {
              "name": "example",
              "text": "```ts\n// Multi-sig STX transfer (2-of-3)\nimport { makeSTXTokenTransfer } from '@stacks/transactions';\n\nconst pubKey1 = '03a...',\n      pubKey2 = '02b...',\n      pubKey3 = '03c...';\n\nconst transaction = await makeSTXTokenTransfer({\n  recipient: 'SP2J6ZY48GV1EZ5V2V5RB9MP66SW86PYKKQHX0A73',\n  amount: 500000n,\n  numSignatures: 2,\n  publicKeys: [pubKey1, pubKey2, pubKey3],\n  signerKeys: [privateKey1, privateKey2],\n  network: 'mainnet',\n});\n```"
            }
          ],
          "examples": [
            {
              "code": "// Basic STX transfer\nimport { makeSTXTokenTransfer, broadcastTransaction } from '@stacks/transactions';\n\nconst transaction = await makeSTXTokenTransfer({\n  recipient: 'SP2J6ZY48GV1EZ5V2V5RB9MP66SW86PYKKQHX0A73',\n  amount: 1000000n,\n  senderKey: 'b244296d5907de9864c0b0d51f98a13c52890b0498ba04f738be28738bc5821401',\n  network: 'testnet',\n});\n\nconst result = await broadcastTransaction({ transaction, network: 'testnet' });\nconsole.log('Transaction ID:', result.txid);",
              "language": "ts"
            },
            {
              "code": "// Multi-sig STX transfer (2-of-3)\nimport { makeSTXTokenTransfer } from '@stacks/transactions';\n\nconst pubKey1 = '03a...',\n      pubKey2 = '02b...',\n      pubKey3 = '03c...';\n\nconst transaction = await makeSTXTokenTransfer({\n  recipient: 'SP2J6ZY48GV1EZ5V2V5RB9MP66SW86PYKKQHX0A73',\n  amount: 500000n,\n  numSignatures: 2,\n  publicKeys: [pubKey1, pubKey2, pubKey3],\n  signerKeys: [privateKey1, privateKey2],\n  network: 'mainnet',\n});",
              "language": "ts"
            }
          ]
        }
      ],
      "examples": [
        {
          "code": "// Basic STX transfer\nimport { makeSTXTokenTransfer, broadcastTransaction } from '@stacks/transactions';\n\nconst transaction = await makeSTXTokenTransfer({\n  recipient: 'SP2J6ZY48GV1EZ5V2V5RB9MP66SW86PYKKQHX0A73',\n  amount: 1000000n,\n  senderKey: 'b244296d5907de9864c0b0d51f98a13c52890b0498ba04f738be28738bc5821401',\n  network: 'testnet',\n});\n\nconst result = await broadcastTransaction({ transaction, network: 'testnet' });\nconsole.log('Transaction ID:', result.txid);",
          "language": "ts"
        },
        {
          "code": "// Multi-sig STX transfer (2-of-3)\nimport { makeSTXTokenTransfer } from '@stacks/transactions';\n\nconst pubKey1 = '03a...',\n      pubKey2 = '02b...',\n      pubKey3 = '03c...';\n\nconst transaction = await makeSTXTokenTransfer({\n  recipient: 'SP2J6ZY48GV1EZ5V2V5RB9MP66SW86PYKKQHX0A73',\n  amount: 500000n,\n  numSignatures: 2,\n  publicKeys: [pubKey1, pubKey2, pubKey3],\n  signerKeys: [privateKey1, privateKey2],\n  network: 'mainnet',\n});",
          "language": "ts"
        }
      ]
    },
    {
      "id": "makeContractDeploy",
      "name": "makeContractDeploy",
      "kind": "function",
      "description": "Generates a Clarity smart contract deploy transaction",
      "tags": [
        {
          "name": "param",
          "text": "txOptions - an options object for the contract deploy",
          "param": {
            "name": "txOptions",
            "type": "SignedContractDeployOptions | SignedMultiSigContractDeployOptions",
            "description": "an options object for the contract deploy"
          }
        },
        {
          "name": "return",
          "text": ""
        }
      ],
      "source": {
        "file": "/tmp/stacks.js/packages/transactions/src/builders.ts",
        "line": 318
      },
      "signatures": [
        {
          "parameters": [
            {
              "name": "txOptions",
              "schema": {
                "anyOf": [
                  {
                    "$ref": "#/types/SignedContractDeployOptions"
                  },
                  {
                    "$ref": "#/types/SignedMultiSigContractDeployOptions"
                  }
                ]
              },
              "required": true,
              "description": "an options object for the contract deploy"
            }
          ],
          "returns": {
            "schema": {
              "$ref": "#/types/Promise",
              "x-ts-type-arguments": [
                {
                  "$ref": "#/types/StacksTransactionWire"
                }
              ]
            }
          },
          "description": "Generates a Clarity smart contract deploy transaction",
          "tags": [
            {
              "name": "param",
              "text": "txOptions - an options object for the contract deploy",
              "param": {
                "name": "txOptions",
                "type": "SignedContractDeployOptions | SignedMultiSigContractDeployOptions",
                "description": "an options object for the contract deploy"
              }
            },
            {
              "name": "return",
              "text": ""
            }
          ]
        }
      ]
    },
    {
      "id": "makeContractCall",
      "name": "makeContractCall",
      "kind": "function",
      "description": "Generates a Clarity smart contract function call transaction",
      "tags": [
        {
          "name": "param",
          "text": "txOptions - an options object for the contract function call",
          "param": {
            "name": "txOptions",
            "type": "SignedContractCallOptions | SignedMultiSigContractCallOptions",
            "description": "an options object for the contract function call"
          }
        },
        {
          "name": "return",
          "text": ""
        }
      ],
      "source": {
        "file": "/tmp/stacks.js/packages/transactions/src/builders.ts",
        "line": 600
      },
      "signatures": [
        {
          "parameters": [
            {
              "name": "txOptions",
              "schema": {
                "anyOf": [